{"authority_boundary":{"may_change_fpo_authority":false,"return_only":true},"capability_id":"ai.diagnostic.capability","capability_revision":"phase4a-v1","capability_run_id":"caprun-A2-002","case_id":"A2","dispatch_id":"DISP-A2-002","fixture_ref":"phase4a/fixtures/A2-incomplete-evidence.json","operation_id":"OP-A2-002","return_schema_ref":"phase4a/contracts/ai_capability_return.schema.json","schema":"fpo.phase4a.dispatch-packet.v1"}
